a photo of a woman in a costume and a sword_____hyperborean priestess with long neck and geometric headdress and mask, low poly, boho style, rich wooden jewerly, concept art, abstract background, by boris vallejo, deak ferrand, and greg rutkowski and rhads 
a photo of a person standing in a forest_____a man starting a fire in a forest by daniel richter and beeple, psychological, dripping paint, high quality render, masterpiece 
a photo of a woman surrounded by butterflies_____butterflies exploding out a girls head, smoke, flames, full - length, oil painting in a renaissance style, very detailed, haunted background, painted by caravaggio, greg rutkowski, sachin teng, thomas kindkade, alphonse mucha, norman rockwell, tom bagshaw 
a photo of a woman with a horned headdre_____portrait hyperborean priestess with long neck and hands geometric headdress and mask, winter snow ice, low poly, concept art, abstract background, by boris vallejo, deak ferrand, and greg rutkowski and rhads 
a photo of a man with a gun and another man with a hat_____man in front of a firing squad refuses a cigarette 
a photo of a man with a face painted on it_____painted closeup portrait of fierce sneering elder by chuck close, charcoal on canvas 
a photo of a dog pin_____cute cartoon corgi face, adorable, happy, enamel pin 
a photo of a dragon flying over a river_____medieval fantasy, raytraced realism, cottagecore - styled oil painting, a cute friendly dragon is surrounded by snowy brick castles fortresses, anatomically accurate quadruped, art by peter mohrbacher, and brothers hildebrandt, as a book cover illustration, high - readability, intricately detailed, elegant 
a photo of a leopard with a light on it's head_____symmetry!! a tiny cute chinese spring festival oriental tale mascot leopard - lion toys, magic, intricate, smooth line, light dust, mysterious dark background, warm top light, hd, 8 k, smooth ï¼Œ sharp high quality artwork in style of greg rutkowski, concept art, blizzard warcraft artwork, bright colors 
a photo of a cat with a crown on its head_____symmetry!! a tiny cute chinese spring festival oriental tale mascot cat - lion toys, magic, intricate, smooth line, light dust, mysterious dark background, warm top light, hd, 8 k, smooth ï¼Œ sharp high quality artwork in style of greg rutkowski, concept art, blizzard warcraft artwork, bright colors 
a photo of two astronauts in space suits_____morty in a spacesuit roams the universemorty fights monsters in the universe, beautiful details, wide angle action shot, photorealistic, high end design, 8 k, octane render, neo tokyo nuclear holocaust background, mist, ornate, lasers, volumetric lighting - h 1 2 0 0 
a photo of a living room with a couch and a table_____flat pastel neutral color graffiti abstract art 
a photo of sponge sponge and patrick_____spongebob's pants are made of hair, digital art, 
a photo of a building with a lot of windows_____a beautiful detailed highly detailed abandoned nature navy fort unfinished building industrial architecture architecture by louis sullivan, flowers lake tron, archdaily, wallpaper, highly detailed, trending on artstation. 
a photo of a futuristic city surrounded by trees_____urbex by tom wright, at dusk steampunk cosmic morning sun atlantis elysian sunlight universe neon noir extraterrestial tron bioshock tundra myst at dawn matte painting retrowave poppy landscape assassin's creed rainforest fantasy evil, archdaily, wallpaper, highly detailed, trending on artstation. 
a photo of two tigers jumping in the air_____concept art of translucent glowing tiger dancing, big booty, flowy, melting, round moon, swirly clouds, very detailed, volumetric light, mist, fine art, textured oil over canvas, dragons, epic fantasy art, very colorful, ornate intricate scales, gold skulls, fractal gems, 8 k, hyper realistic, high contrast 
a photo of a man with a red eye_____a portrait of a male tiefling scholar by krenz cushart, ruan jia, karol bak, beautiful background, delicate, digital illustration, very - detailed, deviantart, artstation 
a photo of the characters from the movie pio pio_____a pixar movie poster back to the futur 
a photo of a man in a brown jacket_____george washington by kehinde wiley and rembrandt : 5. photorealistic facial features, portrait, detailed face, ultra high details, large, close - up : 2. 
a photo of a man standing in front of a fire_____beautiful garden at twilight by nicholas roerich and jean delville and maxfield parrish, glowing paper lanterns, strong dramatic cinematic lighting, ornate tiled architecture, lost civilizations, smooth, sharp focus, extremely detailed 
a photo of a man with a beard and glasses_____a very drunk person named aaron, sharp focus, award - winning, masterpiece, extremely detailed, intricate, realistic 
a photo of santa claus and his reindeers_____santa's sleigh being pulled by reindeer beetles realistic cinematic 3 5 mm 
a photo of a mountain with a giant monster in the fore_____mount epic brown elekk screenshot world of warcraft mounts worldboss bioluminecant light concept sketch art and by feng zhu alena aenami artworks in 4 k beeple, by thomas kinkade heartstone overwatch blizzard 3 d rtx hdr 
a photo of a building with icicles hanging from the roof_____a beautiful very detailed illustration of abandoned urbex unfinished building city nature industrial architecture architecture building spaceport by caspar david friedrich, scumm bar meadow nature synthwave, archdaily, wallpaper, highly detailed, trending on artstation. 
a photo of a tree house in the woods_____a beautiful very detailed illustration of patios and deck building unfinished building architecture city nature urbex industrial architecture by peter doig, anime meadow uv light fantasy at fall nature, archdaily, wallpaper, highly detailed, trending on artstation. 
a photo of a woman with gears on her head_____a portrait of a female robot made from a cloud of images being very grateful to the creator, very intricate details, futuristic steampunk, octane render, 8 k, trending on artstation 
a photo of a elf with a wand_____adult male elf ; 2 5 years ; sharp effeminate face ; elf ; clean shaven ; long golden hair ; golden horns ; patches of scales ; pointed ears ; in the style of fruits basket ; trending on artstation ; cinematic ; high detail ; digital art ; anime key visual ; 
a photo of a man with a hamburger in his mouth_____man in tux with a giant cheeseburger head by junji ito 
a photo of a fox and a fox in the jungle_____anthropomorphic foxes animals, dressed as hot raver girl dancers, dance club in tropical paradise, many woodland creatures dancing, concept design, contrast, hot toys, kim jung gi, greg rutkowski, zabrocki, karlkka, jayison devadas, trending on artstation, 8 k, ultra wide angle, pincushion lens effect 
a photo of a robot with a light_____spaghetti c 3 po, lomography 4 0 0 
a photo of two people with glasses on their heads_____science fiction, masculine lynx - headed engineer, studio ghibli, pixar and disney animation, sharp, disney concept art watercolor illustration by mandy jurgens and alphonse mucha and alena aenami, pastel color palette, dramatic lighting, highly detailed 
a photo of a robot with a woman's face_____a portrait of a female robot made from code, very intricate details, octane render, 8 k, trending on artstation 
a photo of a red pig toy in a crowd_____a gummy bear performing at woodstock concert. 3 5 mm film, 
a photo of a woman with long hair_____portrait of emily wickersham as natalie portman by greg manchess 
a photo of a woman with red hair and a mask_____an emo portrait painting by edward hopper. short dark brown messy pixie haircut, large black eyes, antichrist eyes, slightly rounded face, pointed chin, thin lips, small nose, black tank top, black leather jacket, black knee - length skirt, black choker, black helmet, charcoal and ink splattered solarpunk portrait 
a photo of a lizard holding a book_____victo ngai cute chameleon reading a book, sticker design, highly detailed, high quality, digital painting, by ross tran and studio ghibli and alphonse mucha, artgerm 
a photo of a woman with long hair_____portrait painting of a west hightland white, ultra realistic, concept art, intricate details, eerie, highly detailed, photorealistic, octane render, 8 k, unreal engine. art by artgerm and greg rutkowski and charlie bowater and magali villeneuve and alphonse mucha 
a photo of a stadium with a football field_____photo cartoon bd illustration comic manga painting of stadium environement : 5 fantasy environement, digital painting : 1 fat brush concept sketch artist bd enki bilal : 1 0 
a photo of a wooden frame on grass_____brown coffin laying on grass in a graveyard on a cloudy, rainy, day. a framed picture of emma watson stands beside it. 
a photo of a mountain scene with a man standing on a rock_____the great divide, digital painting, highly detailed, concept art, trending on artstation, epic composition, sharp focus, flawless render, masterpiece, volumetric lighting 
a photo of a woman with long hair and a white shirt_____2 d character design, female rapper, vector art, digital art, portrait, 4 k, 8 k, sharp focus, smooth, illustration, concept art, music artist 
a photo of a panda and a panda bear_____symmetry!! a tiny cute chinese spring festival oriental tale mascot panda - lion toys, magic, intricate, smooth line, light dust, mysterious dark background, warm top light, hd, 8 k, smooth ï¼Œ sharp high quality artwork in style of greg rutkowski, concept art, blizzard warcraft artwork, bright colors 
a photo of a person with a red light on their face_____a void colossus with shadowy tendrils and piercing red eyes creeping through a white background, grunge, artstation, high quality, hyper detailed 
a photo of a person with a blur effect_____the prince of the sun, key anime visual, digital art, by wlop artgerm kuvshinov ilya, sharp focus, very detailed, 4 k upscaled _ image 
a photo of two people dressed as ra and ra ra ra ra ra ra ra ra ra ra_____anthropomorphic racoon animal, dressed as a raver chick dancer, dance club in the forest, many woodland creatures dancing, concept design, contrast, hot toys, kim jung gi, greg rutkowski, zabrocki, karlkka, jayison devadas, trending on artstation, 8 k, ultra wide angle, pincushion lens effect 
a photo of a river surrounded by trees_____render of dreamy beautiful landscape, dreamy, by herbaceous plants, artger, large scale, details vintage photo hyper realistic ultra realistic photo realistic photography, unreal engine, high detailed, 8 k 
a photo of a woman with a flower in her hair_____kodak portra 4 0 0, wetplate, photo, surreal, weird fashion, in the nature, highly detailed face, very beautiful model, portrait, ultra - realistic and lifelike eyes, close up, extravagant dress, carneval, animal, wtf, photographed by paolo roversi style and julia hetta 
a photo of a woman with a large headpiece and a large necklace_____rococo cyberpunk empress, highly detailed, portrait, digital painting, trending on artstation, concept art, sharp focus, illustration, art by artgerm and greg rutkowski and magali villeneuve 
a photo of a woman with a cat on her shoulder_____victo ngai girl warrior sticker decal design, highly detailed, high quality, digital painting, by ross tran and studio ghibli and alphonse mucha, artgerm 
a photo of a house that is burned_____a derelict burnt out 1 9 6 0 s house, with dark burnt rooms, and no stairs. realistic. seen from outside. 3 5 mm 
a photo of a green wall with plants growing on it_____futuristic sustainable vertical farm, photo realistic, 8 k 
a photo of a city_____james graham ballard, highrise, sustainability, octane render, minimal design 
a photo of a girl holding a los_____ghibli style half cat half kpop idol with blue fur woman wearing a pink dress eating a popsicle. 
a photo of a robot on a street_____1 9 9 0 s photograph. a giant robot standing in the high street of a run down seaside town 
a photo of a dog made out of folded paper_____adorable corgi puppy, intricate paper quilling, white background 
a photo of a sticker of a woman with a long hair and a long dress_____victo ngai demoness sticker decal design, highly detailed, high quality, digital painting, by ross tran and studio ghibli and alphonse mucha, artgerm 
a photo of a man with a red shirt_____a void colossus with shadowy tendrils and piercing red eyes creeping through a white background, grunge, artstation, high quality, hyper detailed 
a photo of a tree house with a full moon in the background_____a beautiful very detailed render of tiny home nature architecture unfinished building city by william pereira, neon noir darkacademia reclaimed by nature uv light nightvision assassin's creed fisheye thermal imaging cosmic cyberpunk, archdaily, wallpaper, highly detailed, trending on artstation. 
a photo of a peacock with a peacock tail_____symmetry!! a tiny cute chinese spring festival oriental tale mascot peacock - lion toys, magic, intricate, smooth line, light dust, mysterious dark background, warm top light, hd, 8 k, smooth ï¼Œ sharp high quality artwork in style of greg rutkowski, concept art, blizzard warcraft artwork, bright colors 
a photo of a robot with a big mouth_____doom eternal, evangelion, game concept art, veins and worms, muscular, crustacean exoskeleton, chiroptera head, chiroptera ears, mecha, ferocious, fierce, hyperrealism, fine details, artstation, cgsociety, zbrush, no background 
a photo of a painting of a woman sitting at a table_____a painting by edward hopper of a group of people all excited about one entity, it was so clear and vibrant that it made the lightbulb seem brighter and the personage at the top was the most striking. 
a photo of a person walking through a forest_____lost by alena aenami 
a photo of a field of mushrooms with a laptop_____a realistic painting of a vintage computer crt, in a park, in and advanced state of decay, psychedelic mushrooms all around, in a post apocalyptic city, ghibli, daytime, dynamic lighting 
a photo of a woman in a white dress holding a bow_____portrait of a young beautiful finnish norwegian swedish scandinavian model as archer, jodhpurs greg manchess painting by sargent and leyendecker, studio ghibli fantasy close - up shot asymmetrical intricate elegant matte painting illustration hearthstone, by greg rutkowski by greg tocchini by james gilleard 
a photo of a woman in a white and black dress_____portrait of an angle woman with two wings wearing shiny black transparent leather suit and an astronaut helmet, english face, refined features, moon goddess, long snow - white hair by jean gerome, edward hopper and james jean, hyper detail, 8 k, high resolution, ultra detailed 
a photo of two people in space suits_____two scientists wearing red rick owens fusion core hazmat suits with their hands in their pockets escaping the glowing geometric vortex by frank frazetta 
a photo of a woman with a hat_____frontal portrait of ragged, worried twin women, by john singer sargent and j. c. leyendecker. 
a photo of a man kneeling in a field of poppies_____hyperrealistic portrait of a philippine character in a scenic environment, war, flowers, rain, by beksinski zdzislaw, yoro sean, buchholz, quint, christensen james c., 
a photo of a sculpture made of a flower_____marble sculpture of a fractal being, highly realistic, 4 k, studio lighting 
a photo of a woman with long hair and blue eyes_____painted closeup portrait of intense woman, fierce, fantasy, intricate, elegant, extremely detailed by by chuck close, charcoal on canvas 
a photo of a man with blue hair and a hoodie_____adult male elf ; 2 5 years ; sharp effeminate face ; elf ; clean shaven ; long golden hair ; golden horns ; patches of scales ; pointed ears ; in the style of death note ; trending on artstation ; cinematic ; high detail ; digital art ; anime key visual ; 
a photo of two men in a golden frame_____george washington by kehinde wiley and rembrandt : 5. photorealistic facial features, portrait, detailed face, ultra high details, large, close - up : 1. 
a photo of a waterfall in the mountains_____by cg society 
a photo of a desert with a plane flying over it_____a flash flood in the sahara desert 
a photo of a tunnel with a light at the end_____a beautiful painting of chornobyl by nekro and pascal blanche and syd mead and greg rutkowski and sin jong hun and victo ngai and simon stalenhag and chris voy and ansel adams. in style of cg art. ray tracing. cel shading. hyper detailed. realistic. ue 5. maya. octane render. 
a photo of a woman with a hoodie and a hoodie_____symmetrical centered medium portrait of maya ali as a sorcerer, elden ring, matte painting concept art, pastel colours, official fanart behance hd artstation by jesper ejsing, by rhads and makoto shinkai and lois van baarle and ilya kuvshinov and rossdraws 
a photo of a woman with a gun_____by artstation, cgsociety 
a photo of a tree with a large metal structure in the middle_____a beautiful painting of chernobyl in autumn by nekro and pascal blanche and syd mead and greg rutkowski and sin jong hun and victo ngai and simon stalenhag and chris voy. in style of cg art. ray tracing, cel shading, 3 d. ue 5. hyper detailed. realistic. maya. octane render. 
a photo of a painting of a lake with red leaves_____autumn scenery, red tree, lake, trees, calm, autumn, cast shadows, amazing impressionistic oil painting by alexi zaitsev, melinda matyas, denis sarazhin, karl spitzweg, intricate details, fractal leaves, high quality, brush strokes, award winning, sharp focus, cool white 
a photo of a man with long hair and a beard_____painted closeup portrait of sean penn, masculine, young, charming, majestic, athletic, fantasy, intricate, elegant, extremely detailed digital painting, trending artstation, concept art, sharp focus illustration art by alphonse mucha, greg rutkowski, craig mullins 
a photo of a mountain landscape with a waterfall_____the gaint ring, future, render of dreamy beautiful landscape, fantasy dreamy, artger, large scale, details vintage photo hyper realistic ultra realistic photo realistic photography, unreal engine, high detailed, 8 k 
a photo of a futuristic city with lots of buildings_____a beautiful painting of pripyat by nekro and pascal blanche and syd mead and greg rutkowski and beeple and victo ngai and simon stalenhag and chris voy. in style of cg art. ray tracing, cel shading, 3 d. ue 5. hyper detailed. realistic. maya. octane render. 
a photo of a teddy bear on a building_____portrait of haribo bear in future city, 
a photo of a city with a lot of buildings_____james graham ballard, highrise, sustainability, octane render, highly detailed 
a photo of a man standing in front of a house_____creepy man standing at the bedroom window of a burnt out 1 9 6 0 s house black and white scaray dramatic cinematic 3 5 mm 
a photo of a field with trees and grass_____snowing meadow with black flowers, sad feeling, in style of john harris, watercolor, artstation 
a photo of two robots in a field_____screenshot by bungie and weta 
a photo of a statue of a woman in a forest_____by maxfield parrish 
a photo of two demonic angels in a cave_____flying succubi in a medieval dungeon, purple armor, purple blade, stunning, detailed, by artgerm, by greg rutkowski, by luis royo, by pixar, by myazaki, gothic, final fantasy, fantasy, medieval 
a photo of two people dressed as ska and ska_____anthropomorphic racoon ferret swan mouse rabbit animals, dressed as a raver chick dancer, dance club in the forest, many woodland creatures dancing, concept design, contrast, hot toys, kim jung gi, greg rutkowski, zabrocki, karlkka, jayison devadas, trending on artstation, 8 k, ultra wide angle, pincushion lens effect 
a photo of a man with long hair and beard_____painted closeup portrait of tree man, masculine, fierce, charming, majestic, fantasy, intricate, elegant, extremely detailed digital painting, concept art, sharp focus illustration art by alphonse mucha by chuck close, charcoal on canvas 
a photo of a woman with long blonde hair_____beautiful portrait of emily wickersham 
a photo of a woman with a very big boo_____studio portrait photo of genetic hybrid face of megan fox and the predator 
a photo of a character from the game darkside_____highly detailed magician god holding a divine staff character design, cyberpunk crystal helmet and armor, cape, warframe, magician style, cyberpunk, elegant, highly detailed, ray tracing, smooth, sharp focus, art by fenghua zhong, peter mohrbacher, ruan jia, liuyuan lange, akiya kageichi, ayami kojima, joseph leyendecker 
a photo of an astronaut standing on the moon_____render of man lost in space, dreamy, artger, large scale, details vintage photo hyper realistic ultra realistic photo realistic photography, by vladimir motsar, unreal engine, high detailed, 8 k 
a photo of a group of people in a room_____bubonic plague 
a photo of a girl with flowers in her hair_____artistic painting, ice princess in snow, ophelia, wearing ornate robes, beautiful eyes and lips, floating supine in a forest pond, flowers, art by artgerm and wlop and brom, highly detailed, 8 k, cinematic, digital painting, sharp focus, illustration, masterpiece 
a photo of a white egg with a black hole_____geodesic dreams of buckminster fuller, by artstation, deviantart, artslant artbox, cgsociety, gfxartist, artful, tadao ando, 4 k, 
a photo of a cemetery with a cemetery in the background_____a beautiful photorealistic painting of cemetery urbex unfinished building building industrial architecture nature abandoned by thomas cole, nature extraterrestial tron forest darkacademia thermal vision futuristic tokyo, archdaily, wallpaper, highly detailed, trending on artstation. 
a photo of a lizard with a green head and a green body_____victo ngai cute chameleon, sticker design, highly detailed, high quality, digital painting, by ross tran and studio ghibli and alphonse mucha, artgerm 
a photo of a man walking down a street in a city_____a beautiful painting of pripyat by nekro and pascal blanche and syd mead and greg rutkowski and beeple and victo ngai and simon stalenhag and chris voy. in style of cg art. ray tracing, cel shading, 3 d. ue 5. hyper detailed. realistic. maya. octane render. 
a photo of a green and purple background_____shrek dressed up as a gorgeous cosmic psychedelic geisha 
a photo of a windmill in the middle of a village_____a beautiful painting of chernobyl by nekro, pascal blanche, john harris, greg rutkowski, sin jong hun, moebius, simon stalenhag. in style of cg art. ray tracing. cel shading. hyper detailed. realistic. ue 5. maya. octane render. 
a photo of a woman with a crown on her head_____portrait hyperborean priestess with long neck and hands geometric headdress and mask, winter snow ice, low poly, concept art, abstract background, by boris vallejo, deak ferrand, and greg rutkowski and rhads 
a photo of a woman with a red face and a blue dress_____symmetrical centered medium portrait of maya ali as a sorcerer, adventure time style, matte painting concept art, pastel colours, official fanart behance hd artstation by jesper ejsing, by rhads and makoto shinkai and lois van baarle and ilya kuvshinov and rossdraws 
a photo of two women in green dresses_____beautiful viking woman surrounded by treasure and gold, perfect face, green eyes, wearing an ornate golden robe, two cats in background, tom bagshaw 
a photo of a surfer riding a wave_____tidal wave of phlegm 
a photo of three women in white dresses_____portrait of two young beautiful gorgeous irresistible captivating latvian belarusian finnish norwegian swedish glamour models wearing leotard, jodhpurs greg manchess painting by sargent and leyendecker, studio ghibli close - up asymmetrical intricate elegant illustration hearthstone, by greg rutkowski by greg tocchini by james gilleard 
a photo of a woman with a dark hood and red eyes_____portrait of a cloaked female devil, evil, ominous, luscious, pointy teeth, stunning, detailed, by artgerm, by greg rutkowski, by luis royo, by pixar, by myazaki, gothic, final fantasy, fantasy, medieval 
a photo of a bear playing a guitar_____a gummy bear performing at woodstock concert. 3 5 mm film, 
a photo of a green box with a gold and blue design_____symmetry!! a manufactured mystical aqua green ï¼Œ canal blue ï¼Œ bronze red of medieval epic random box cube levitate, floral!, elegant, highly detailed, magic surge, intricate, unreal engine 5, concept art ï¼Œ by greg rutkowski, loish, highly rendered, digital painting, artstation hq 
a photo of the rock in a painting_____a portrait of dwayne johnson, art in the style of rembrandt!! intricate. ultra detailed, oil on canvas, wet - on - wet technique, pay attention to facial details, highly realistic, cinematic lightning, intricate textures, illusionistic detail, 
a photo of a woman with a cat_____beautiful viking woman surrounded by treasure and gold, perfect face, green eyes, wearing an ornate golden robe, two ginger cats in background, tom bagshaw 
a photo of two cats running through a forest_____a wholesome animation key shot of an anthro - lynx child, child with the head of a lynx, running through a village in an alien forest, studio ghibli, pixar and disney animation, sharp, disney concept art watercolor illustration by mandy jurgens and alphonse mucha and alena aenami, pastel color palette, dramatic lighting 
a photo of a street with many buildings_____a realistic architectural visualization of a sustainable mixed - use post - modern post - growth walkable people oriented urban development. 
a photo of a white dog on a brown background_____west hightland white terrier, sweet, affectionate, tender, cute, old painting 
