a photo of a man in a space suit standing in front of a large, blue and orange_____morty in a spacesuit roams the universe, beautiful details, wide angle action shot, photorealistic, high end design, 8 k, octane render, neo tokyo nuclear holocaust background, mist, ornate, lasers, volumetric lighting - h 1 2 0 0 
a photo of a man with tattoos on his arms_____painted closeup portrait of snake man, masculine, fierce, charming, majestic, fantasy, intricate, elegant, extremely detailed digital painting, concept art, sharp focus illustration art by alphonse mucha by chuck close, charcoal on canvas 
a photo of a man with a hat and a man with a beard_____harrison ford by kehinde wiley and rembrandt : 5. photorealistic facial features, portrait, detailed face, ultra high details, large, close - up : 1. 
a photo of a street with a person walking down it_____illustration of a medieval desolate paris street scene by shaun tan, clean, emptyness, torn paper decollage, graphic novel, oil on canvas by edward hopper, ( by mattias adolfsson ), by moebius 
a photo of a woman sitting on a rock_____divine homonculus, digital painting, highly detailed, concept art, trending on artstation, epic composition, sharp focus, flawless render, masterpiece, volumetric lighting 
a photo of a red teddy bear on a blue wall_____portrait of haribo bear in future city, color and shape focus, central composition, n 
a photo of a woman in a native costume_____portrait of a dancing eagle woman, beautiful blonde haired lakota sioux goddess, intricate, highly detailed art by james jean, ray tracing, digital painting, artstation, concept art, smooth, sharp focus, illustration, artgerm and greg rutkowski and alphonse mucha, 8 k 
a photo of a colorful paper art piece_____pastel graffiti abstract torn paper art 
a photo of a tree in the middle of a field_____a macro shot of an alien flower in a flowering alien landscape with a winding river reflecting the sky, alien flora, cinematic light, symmetrical, in the style of martin johnson heade and h. r. giger and francisco de goya! 
a photo of two men with their faces painted like faces_____harrison ford by kehinde wiley and rembrandt : 5. photorealistic facial features, portrait, detailed face, ultra high details, large, close - up : 1 0 0 0. 
a photo of a man with a beard_____black and white head shot, studio photograph of a male symmetrical handsome andrea belluci the painter artist, casual clothes, anxiety and depression, intricate, elegant, highly detailed, hyper realistic, dark background, flickr, clear, smooth, 4 k, 3 0 0 dpi, sharp focus, shot by canon 
a photo of a woman with a large head and a large face_____neon japaneese nymphomaniac, mixed media collage, assemblage, photomontage, minimalist, contemporary art, punk art, photorealistic, portrait, expressionism, masterpiece, dynamic composition, spectacular quality, intricate oil details, shattered glass texture, neon, chains, smoke, contrasted, harmonic colors 
a photo of a man riding a horse in the mountains_____mount epic armored blue wind rider screenshot world of warcraftmounts 3 d alejandro alvarez alena aenami artworks in 4 k beeple, by thomas kinkade hearstone league of legends dofus overwatch 
a photo of a group of people with different hair styles_____2 d character design, male pop singer, vector art, digital art, portrait, 4 k, 8 k, sharp focus, smooth, illustration, concept art, music artist 
a photo of a colorful background_____gummy bear mosh pit, photography, 3 5 mm film 
a photo of robots in a room_____robots creating new robots in a factory, oil painting by justin gerard, deviantart, hd, 8 k 
a photo of a man with white hair and beard_____white haired robe fu xi full male body portrait, sit upright on the ground, very long white beard and hair, fine kindness delicate prefect face features gaze, piercing eye, elegant, smooth, style of tom bagshaw, cedric peyravernay, peter mohrbacher, victo nga, 4 k hd illustrative wallpaper, animation style, chinese style 
a photo of a tree and a building_____beautiful ancient temple in a formal garden. by edmund dulac and maxfield parrish and nicholas roerich. ornate carvings, geometric decorations. rich color. dramatic cinematic lighting with god rays. extremely clear and detailed. cell shaded. dynamic composition 
a photo of a group of naked men_____a plate illustration of milton's paradise lost 
a photo of a man walking down a street_____concept art of a silent hill monster. painted by edward hopper. 
a photo of a girl walking through a forest_____studio ghibli anime, adorable woman walking in the forest, romantic magical, fairytale, fantasy, pastel colors 
a photo of a man with a glass of wine_____a very drunk man, sharp focus, award - winning, masterpiece, extremely detailed, intricate, realistic, 4 k, hyperrealism 
a photo of two men with guns_____han solo by kehinde wiley and rembrandt : 5. photorealistic facial features, portrait, detailed face, ultra high details, large, close - up : 1. 
a photo of a building with a lot of lines_____a beautiful ultradetailed illustration of parliament architecture building urbex unfinished building abandoned by federico babina, wilderness landscape flowers infrared uv light bladerunner 2 0 4 9 tron alien lake at night anime neon signs at dusk rainforest thermal imaging futuristic sea, archdaily, wallpaper, highly detailed, trending on artstation. 
a photo of a robot standing in front of a city_____photo cartoon bd illustration comic manga painting of hangar environement : 5 fantasy environement, digital painting : 1 fat brush concept sketch artist bd enki bilal : 1 0 
a photo of a futuristic city with people walking through it_____photograph, futuristic scene, interstellar, brutalist style architecture, space, finely detailed oil painting, soft light, 8 k, dramatic composition, dramatic lighting, sharp focus, octane render, masterpiece, by adrian ghenie and jenny saville and zhang jingna 
a photo of two women with colorful hair and feathers_____of beautiful zoelea ixchel no ra, dancing eagle woman, goddess, mayan, 1 1 1 1, engulfed in funkadelic aura, surreal illustration, alphonse mucha, rhads, ross tran, artstation, artgerm, octane render, 1 6 k 
a photo of a room with a tree and a window_____urbex by henri rousseau, scumm bar, archdaily, wallpaper, highly detailed, trending on artstation. 
a photo of a man holding a red flag_____numeral 1 8! printed on a huge cloak standard - bearer ï¼Œ huge flag, towards the storm, intricate. magic light dust, ï¼Œ dim lighting, unreal engine 5, concept art ï¼Œ by greg rutkowski, loish, highly rendered, digital painting, artstation, artstation hq, mysterious toplight 8 k 
a photo of a woman in a field with flowers_____hyperrealistic portrait of a philippine character in a scenic environment, flowers, by beksinski zdzislaw, yoro sean, buchholz, quint, christensen james c., 
a photo of a city with a car in the middle_____a beautiful painting of pripyat by nekro and pascal blanche and syd mead and greg rutkowski and beeple and victo ngai and simon stalenhag and chris voy. in style of cg art. ray tracing, cel shading, 3 d. ue 5. hyper detailed. realistic. maya. octane render. 
a photo of a man with a beard and a hat_____germ warfare realistic cinematic 3 5 mm 
a photo of a train station with a train track_____a beautiful hyperdetailed render of train station abandoned industrial architecture by ben van berkel, lightpaint tundra retrowave sunlight anime cosmic universe laser neon signs rainforest bioshock nightvision at dawn architecture island evil hyperrealism forest, archdaily, wallpaper, highly detailed, trending on artstation. 
a photo of a dragon flying over a mountain_____mount epic heavenly golden cloud serpent screenshot world of warcraft mounts worldboss bioluminecant light concept sketch art and by feng zhu alena aenami artworks in 4 k beeple, by thomas kinkade heartstone overwatch blizzard 3 d rtx hdr 
a photo of a man standing in a tunnel_____a beautiful painting of chornobyl by nekro and pascal blanche and syd mead and greg rutkowski and sin jong hun and victo ngai and simon stalenhag and chris voy and ansel adams. in style of cg art. ray tracing. cel shading. hyper detailed. realistic. ue 5. maya. octane render. 
a photo of a purple cube with a light coming out_____symmetry!! a manufactured mystical aqua silvery ï¼Œ canal purple ï¼Œ gilded colorful of medieval epic cube levitate, floral!, elegant, highly detailed, magic surge, intricate, unreal engine 5, concept art ï¼Œ by greg rutkowski, loish, highly rendered, digital painting, artstation hq 
a photo of a city with people walking down the street_____anime cartoon of 1 9 5 0 s scifi, tin toy robots, ufo, flying saucer, moon, meninblack, steampunk, alley, streets, walter sickert, earl norem, depth of field, hyperrealistic, octane render detailed and intricate environment 
a photo of two girls in front of a spaceship_____sailor moon anime, dieselpunk, advanced technology, artstation, highly detailed, cute, masterpiece, art by aleksander galevskyi and sergey zabelin and michal kus and christian bravery 
a photo of a girl with flowers and butterflies_____victo ngai chibi succubi sticker decal design, highly detailed, high quality, digital painting, by ross tran and studio ghibli and alphonse mucha, artgerm 
a photo of a church with a moon in the background_____beautiful ink sketch, dieselpunk high fantasy, sunset byzantine sophia cathedral, by chris riddell, ilya kuvshinov, wlop, krenz kushart, boris vallejo, ayami kojima and ayami kojima 
a photo of a pixeled cow_____voxel art bison 
a photo of a group of women doing yoga_____yoga 
a photo of a woman with a flower in her hair_____victo ngai poring decal design, highly detailed, high quality, digital painting, by ross tran and studio ghibli and alphonse mucha, artgerm 
a photo of a garden with a lot of flowers and plants_____beautiful garden at twilight by nicholas roerich and jean delville and maxfield parrish, glowing paper lanterns, strong dramatic cinematic lighting, ornate tiled architecture, lost civilizations, smooth, sharp focus, extremely detailed 
a photo of a waterfall in the jungle_____render of dreamy beautiful landscape, rivendell, dreamy, artger, large scale, details vintage photo hyper realistic ultra realistic photo realistic photography, unreal engine, high detailed, 8 k 
a photo of a group of statues in the desert_____cyber moai on easter island, digital painting, highly detailed, concept art, trending on artstation, epic composition, sharp focus, flawless render, masterpiece, volumetric lighting 
a photo of a field with flowers and lanterns_____beautiful garden at twilight by annie swynnerton and nicholas roerich and jean delville, glowing paper lanterns, strong dramatic cinematic lighting, ornate tiled architecture, lost civilizations, smooth, sharp focus, extremely detailed 
a photo of an astronaut floating in space_____render of man lost in space, dreamy, artger, large scale, details vintage photo hyper realistic ultra realistic photo realistic photography, by vladimir motsar, unreal engine, high detailed, 8 k 
a photo of actress kristen kristen kristen kristen kristen kristen kristen kristen kristen kristen kristen kristen kristen kristen kristen_____emily wickersham 
a photo of a lion with a very big head_____painted closeup portrait of hyena man, masculine, young, charming, majestic, fantasy, intricate, elegant, extremely detailed digital painting, concept art, sharp focus illustration art by alphonse mucha, charcoal on canvas 
a photo of two men with curly hair_____a close - up portrait of zack de la rocha painted by rembrandt, oil painting, baroque painting, highly detailed, 4 k 
a photo of a woman in a trench coat_____rtx 3 0 9 0 on a burberry trench coat on a lots of cash bills 
a photo of a girl with long hair_____character concept art, science fiction, massive long - haired lynx - headed flirtatious masculine adventurer, studio ghibli, pixar and disney animation, sharp, disney concept art watercolor illustration by mandy jurgens and alphonse mucha and alena aenami, pastel color palette, dramatic lighting, highly detailed 
a photo of a cat wearing a mask_____a cat wearing a fake mustache, rainbows, bright colors, psychedelic, fish eye lens, vector art, fantasy poster by helen huang and frank frazetta and salvador dali and norman rockwell, 
a photo of a person in a suit_____by maxfield parrish, greg manchess, mucha 
a photo of a monster with purple and purple colors_____mount epic spectral wolf screenshot world of warcraft mounts worldboss bioluminecant light concept sketch art and by feng zhu alena aenami artworks in 4 k beeple, by thomas kinkade heartstone overwatch blizzard 3 d rtx hdr 
a photo of a futuristic city with neon lights_____isometric cyberpunk diorama!!! in ocean, magical lighting, photorealistic rendering, raytraced reflections, cinematic lighting 
a photo of a woman in a white dress_____by maxfield parrish, greg manchess, mucha 
a photo of a futuristic city with a futuristic building_____unfinished building by santiago calatrava, cgsociety vaporwave flowers tron fisheye rainforest galactic elysian neon signs junglepunk cyberpunk tundra desert sunset morning sun tokyo, archdaily, wallpaper, highly detailed, trending on artstation. 
a photo of a lighthouse in the ocean_____a beautiful painting of a lighthouse on the sea by nekro and pascal blanche and syd mead and greg rutkowski and simon stalenhag. in style of cg art. ray tracing, cel shading, 3 d. ue 5. hyper detailed. realistic. maya. octane render. 
a photo of a man in a suit and a hamburger_____man in tux with a giant cheeseburger head 
a photo of a man with a book_____a star is born, in style of john harris, watercolor, artstation 
a photo of a futuristic city with tall buildings_____futuristic suburban scene, brutalist style architecture, straight edges, buildings, traffic lights, finely detailed oil painting, impasto brush strokes, soft light, 8 k, dramatic composition, dramatic lighting, sharp focus, octane render, concept art, masterpiece, by adrian ghenie and jenny saville and zhang jingna 
a photo of a bunch of robots in a room_____robots creating new robots in a factory line, oil painting by justin gerard, deviantart, pixar 
a photo of a book with a bird on it_____a harry potter book, the cover art is an image of katniss everdeen 
a photo of a male with red hair and horns_____adult male elf ; 2 5 years ; sharp effeminate face ; elf ; clean shaven ; long golden hair ; golden horns ; patches of scales ; pointed ears ; in the style of death note ; trending on artstation ; cinematic ; high detail ; digital art ; anime key visual ; 
a photo of two people in fort fort fort fort fort fort fort fort fort fort fort fort fort_____boris johnson as a fortnite character, with a machine gun, in fortnite 
a photo of a woman in a futuristic suit_____women in fullbody biohazard suit realism, painting by sargent and leyendecker, studio ghibli fantasy close - up shot asymmetrical intricate elegant matte painting illustration hearthstone, by greg rutkowski by greg tocchini by james gilleard 
a photo of a woman with tattoos on her chest_____an emo portrait painting. short dark brown messy pixie haircut, large black eyes, antichrist eyes, slightly rounded face, pointed chin, thin lips, small nose, black tank top, black leather jacket, black knee - length skirt, black choker, black gauntlet, charcoal and bronze, highly detailed, photorealistic, 3 d shading, cgsociety 
a photo of a woman with a sword and a man in the background_____by artstation 
a photo of a woman with a flower in her hand_____victo ngai girl dancer sticker decal design, highly detailed, high quality, digital painting, by ross tran and studio ghibli and alphonse mucha, artgerm 
a photo of a man in a golden outfit holding a sword_____njord viking god of wealth, swedish man dressed in viking clothes, elegant, carrying gold coins, background of ocean, tom bagshaw 
a photo of a male with white hair and blue eyes_____portrait of a beautiful rendition of vergil, devil may cry, illustration, artistic, colorful, hyper detailed, in the style of greg rutkowski 
a photo of a cartoon character in a desert_____field environement aventure video game silence deponia the whispered world daedalic 
a photo of a chinese zodiac sign with a horse_____invocations unto the yaohu yanshi and the lupercalic secret histories : paw walker anthropicon ergo licht : the way of the tail, fang, and claw | when the stars fall all will hear fenrir's howl ðŸŒŒ ðŸ™Œ cry wolf - blessed beasts burn babylon | | whom spake? weasel wordsmith 
a photo of a sticker of a woman with blue hair and a green dress_____victo ngai cute girl paladin sticker decal design, highly detailed, high quality, digital painting, by ross tran and studio ghibli and alphonse mucha, artgerm 
a photo of two women in the jungle_____anthropomorphic fox animal, dressed as hot raver girl dancer, dance club in tropical paradise, many woodland creatures dancing, concept design, contrast, hot toys, kim jung gi, greg rutkowski, zabrocki, karlkka, jayison devadas, trending on artstation, 8 k, ultra wide angle, pincushion lens effect 
a photo of a woman with long hair_____film still, 3 4 3 
a photo of a building with a tree in front of it_____beautiful ancient temple in a formal garden. by annie swynnerton and nicholas roerich and jean delville,. ornate carvings, geometric decorations. rich color. dramatic cinematic lighting with god rays. extremely clear and detailed. cell shaded. dynamic composition, featured on artstation 
a photo of an angel with a halo_____angel by maxfield parrish, greg manchess, mucha 
a photo of a woman with flowers on her head_____hyperrealistic portrait of a philippine character in a scenic environment, flowers, by beksinski zdzislaw, yoro sean, buchholz, quint, christensen james c., 
a photo of a man walking down a street_____illustration of a 2 0 8 0 desolate paris street scene by shaun tan, clean, emptyness, torn paper decollage, graphic novel, oil on canvas by edward hopper, ( by mattias adolfsson ), by moebius 
a photo of a woman with long hair_____painted closeup portrait of intense woman, fierce, fantasy, intricate, elegant, extremely detailed by by chuck close, charcoal on canvas 
a photo of the vampire girl in the vampire diaries_____emily wickersham as black widow 
a photo of a woman with a sword_____njord viking god of wealth, tom bagshaw 
a photo of a garden with a lottoo and a lottoo in the background_____beautiful garden at twilight by annie swynnerton and nicholas roerich and jean delville, glowing paper lanterns, strong dramatic cinematic lighting, ornate tiled architecture, lost civilizations, smooth, sharp focus, extremely detailed 
a photo of a woman with broken glass_____girl from fight club, digital collage, assemblage, photomontage, minimalist, contemporary art, punk art, photorealistic, portrait, expressionism, masterpiece, dynamic composition, spectacular quality, intricate oil details, shattered glass texture, neon, chains, smoke 
a photo of a bird in a cage_____a half - woman half - bird creature trapped in a cage realistic 3 5 mm cinematic 
a photo of two foxes in the woods_____anthropomorphic foxes animals, dressed as a raver chick dancer, dance club on tropical island, many woodland creatures dancing, concept design, contrast, hot toys, kim jung gi, greg rutkowski, zabrocki, karlkka, jayison devadas, trending on artstation, 8 k, ultra wide angle, pincushion lens effect 
a photo of a person standing in front of a pink background_____anthropomorphic ferret animal, dressed as cute raver girl dancer, dance club in tropical paradise, many woodland creatures dancing, concept design, contrast, hot toy, kim jung gi, greg rutkowski, zabrocki, karlkka, jayison devadas, trending on artstation, 8 k, ultra wide angle, pincushion lens effect 
a photo of a woman in a dress and a sword_____a portrait of a character in a scenic environment by peter mohrbacher 
a photo of a robot with a pink background_____c 3 po looks like nick nolte with spaghetti in his mouth 
a photo of a woman with a face painted in blue_____painted closeup portrait of fierce, elegant woman. extremely detailed by chuck close, charcoal on canvas 
a photo of two women dressed in blue and blue_____anthropomorphic blue jay animals, dressed as a raver chick dancer, dance club on tropical island, many woodland creatures dancing, concept design, contrast, hot toys, kim jung gi, greg rutkowski, zabrocki, karlkka, jayison devadas, trending on artstation, 8 k, ultra wide angle, pincushion lens effect 
a photo of a woman in a cave_____alien in a medieval dungeon, luscious, seductive, temptress, stunning, detailed, by artgerm, by greg rutkowski, by luis royo, by pixar, by myazaki, gothic, final fantasy, fantasy, medieval 
a photo of a character in the elderverse_____highly detailed magician god holding a divine staff character design, cyberpunk crystal helmet and armor, cape, warframe, magician style, cyberpunk, elegant, highly detailed, ray tracing, smooth, sharp focus, art by fenghua zhong, peter mohrbacher, ruan jia, liuyuan lange, akiya kageichi, ayami kojima, joseph leyendecker 
a photo of a city with lots of buildings_____a beautiful painting of the heart of pripyat by nekro and pascal blanche and syd mead and greg rutkowski and beeple and victo ngai and simon stalenhag and chris voy. in style of cg art. ray tracing, cel shading, 3 d. ue 5. hyper detailed. realistic. maya. octane render. 
a photo of a man in a red uniform_____a portrait of a military general with a steam - powered prosthetic arm, victorian nobility, hyper detailed 
a photo of a woman surrounded by many objects_____a hyperdetailed character design opulent, elderly grandmaster, fumo yoshitoshi, chinese mythology, ren jing jeong, peter mohrbacher, biomehieronymus spang, arunanondchai, murals, ocohopebright, pg 1 4 8, veileducationary, esllection, warrior, dreamcore, hyper detailed digital art, chinese style, vic
a photo of two monsters in a desert_____mount epic cobalt war talbuk screenshot world of warcraft mounts worldboss borberland comics by jesper ejsing art and by feng zhu, by rhads, makoto shinkai and lois van baarle, ilya kuvshinov, rossdraws global light 3 d rtx hdr 
a photo of a person cleaning up a street_____a person cleaning up a really bad crime scene 
a photo of a man walking through a tunnel_____a beautiful very detailed highly detailed architecture tunnel nature building abandoned industrial architecture unfinished building by ivan aivazovsky, at dawn sci - fi, archdaily, wallpaper, highly detailed, trending on artstation. 
a photo of a woman with a face covered in flowers_____hyperrealistic portrait of a crying philippine character in a scenic environment, war, flowers, rain, by beksinski zdzislaw, yoro sean, buchholz, quint, christensen james c., 
a photo of a man standing in front of a factory_____illustration of a 2 0 8 0 desolate industrial factory nuclear scene by shaun tan, clean, emptyness, torn paper decollage, graphic novel, oil on canvas by edward hopper, ( by mattias adolfsson ), by moebius 
a photo of a man in a coat and hat_____a painting by edward hopper of a man in a trenchcoat carrying an axe 
a photo of batman and the bat_____jabba the hut as batman, movie still, hd 
a photo of a person with a blur effect_____portrait of a cloaked succubus, evil, stunning, detailed, by artgerm, by greg rutkowski, by luis royo, by pixar, by myazaki, gothic, final fantasy, fantasy, medieval 
a photo of a city with a large structure in the middle_____a beautiful painting of pripyat by nekro and pascal blanche and syd mead and greg rutkowski and beeple and victo ngai and simon stalenhag and chris voy. in style of cg art. ray tracing, cel shading, 3 d. ue 5. hyper detailed. realistic. maya. octane render. 
a photo of a man standing on a hill with a mountain in the background_____mount epic wandering ancient screenshot world of warcraft mounts worldboss 3 d alejandro alvarez alena aenami artworks in 4 k beeple, by thomas kinkade hearstone league of legends dofus overwatch 
a photo of a woman in a white suit_____very up close portrait, of fashion elegant sophisticated of a translucent cute dainty cyborg lolita girl ï¼Œ full face frontal centered ï¼Œ big eye, white inflatable jacket, ultra detailed wire decoration, complex golden future mechanical device, micro detail, by nixeu and guweiz weta, sleek curves, intricate sharp focus, trending on artstation hq, deviantart, pinterest, unreal engine 
a photo of a city with a pink sky_____a beautiful painting of a retro futuristic stockholm, hyperdetailed, by simon stalenhag, artstation, pixiv, 8 k, octane render 
a photo of a nude woman in a yellow dress_____an attractive young cybernetic female, highly detailed oil painting, impasto brush strokes, soft light, 8 k, cyberpunk colour palette, dramatic composition, dramatic lighting, sharp focus, masterpiece, by adrian ghenie and jenny saville and zhang jingna 
a photo of a girl walking down a path in the woods_____studio ghibli anime, adorable woman walking in the forest, romantic magical, fairytale, fantasy 
a photo of a woman in a yellow dress and headdre_____of beautiful zoelea ixchel no ra, dancing eagle woman, goddess, mayan, 1 1 1 1, lakota sioux, engulfed in funkadelic aura, surreal illustration, alphonse mucha, rhads, ross tran, artstation, artgerm, octane render, 1 6 k 
a photo of a man in a suit_____concept art of a citizen of the apocalypse, by ralph mcquarrie, full body, highly detailed 
