a photo of a man in a red coat_____george washington by kehinde wiley and rembrandt : 2. photorealistic facial features, portrait, detailed face, ultra high details, large, close - up : 5. 
a photo of a fantasy scene with a giant monster_____alien in a medieval dungeon, ominous, luscious, stunning, detailed, by artgerm, by greg rutkowski, by luis royo, by pixar, by myazaki, gothic, final fantasy, fantasy, medieval 
a photo of a city with a man standing on top of a building_____photo cartoon bd illustration comic manga painting of rooftop environement : 5 fantasy environement, digital painting : 1 fat brush concept sketch artist bd enki bilal : 1 0 
a photo of a demonic creature with a red light_____doom eternal, game concept art, veins and worms, muscular, chiroptera head, chiroptera ears, shark teeth, ferocious, fierce, hyperrealism, fine details, artstation, cgsociety, zbrush, no background 
a photo of a city with a large tower_____a beautiful painting of chernobyl by nekro and pascal blanche and syd mead and greg rutkowski and sin jong hun and victo ngai and simon stalenhag and ansel adams. in style of cg art. ray tracing. cel shading. hyper detailed. realistic. ue 5. maya. octane render. 
a photo of a futuristic city with a futuristic city in the background_____a beautiful painting of a retro futuristic stockholm, hyperdetailed, by simon stalenhag, cyberpunk, synthwave, digital illustration, concept art, wallpaper, artstation, pixiv, 8 k, octane render 
a photo of a creature with a large mouth_____a huge worm - man beast realistic cinematic 3 5 mm 
a photo of a city with buildings and a moon_____isometric cyberpunk diorama!!! in ocean, magical lighting, photorealistic rendering, raytraced reflections, cinematic lighting 
a photo of a city with buildings and a pink sky_____a beautiful ultradetailed anime illustration of unfinished building monolith abandoned building nature urbex industrial architecture city architecture by martin johnson heade, at dawn retrowave myst reclaimed by nature tron thermal imaging anime futuristic, archdaily, wallpaper, highly detailed, trending on artstation. 
a photo of a crowd of people with their hands up_____gummy bear mosh pit, action photography, 3 5 mm film 
a photo of a woman with a mask on her face_____hyperborean priestess with long neck and geometric headdress and mask, low poly, boho style, rich wooden jewerly, concept art, abstract background, by boris vallejo, deak ferrand, and greg rutkowski and rhads 
a photo of a demonic demon with red eyes_____a void beast with shadowy tendrils and piercing red eyes creeping through a white world, grunge, artstation, high quality, hyper detailed 
a photo of a man riding a motorcycle_____a painting by edward hopper of someone on a motorcycle, an urban scene, and a man with sunglasses. 
a photo of a man standing in the middle of a road surrounded by palm trees_____landscape, realistic portrait beautiful painting from scene in terminator robot merged in jurassic park fighting movie scene, hyperdetailed retrofuturism created by thomas kinkade and gustave courbet, fine draw, high detailed, fine lighting, smooth draw, no anomaly. 
a photo of a city with lots of buildings_____a beautiful hyperdetailed painting of unfinished building city hall nature architecture city urbex abandoned industrial architecture by liam wong, synthwave atlantis poppy sunset, archdaily, wallpaper, highly detailed, trending on artstation. 
a photo of a forest with trees and water_____a beautiful painting of chernobyl in the autumn by nekro and pascal blanche and syd mead and greg rutkowski and sin jong hun and moebius and simon stalenhag and ansel adams. in style of cg art. ray tracing. cel shading. hyper detailed. realistic. ue 5. maya. octane render. 
a photo of a brown and black background_____concept for dark souls by egon schiele 
a photo of a man with a dragon on his chest_____a hyperdetailed character design opulent, elderly grandmaster, fumo yoshitoshi, chinese mythology, ren jing jeong, peter mohrbacher, biomehieronymus spang, arunanondchai, murals, ocohopebright, pg 1 4 8, veileducationary, esllection, warrior, dreamcore, hyper detailed digital art, chinese style, vic
a photo of a mouse and a mouse in the woods_____anthropomorphic mouse animals, dressed as a raver chick dancer, dance club in the forest, many woodland creatures dancing, concept design, contrast, hot toys, kim jung gi, greg rutkowski, zabrocki, karlkka, jayison devadas, trending on artstation, 8 k, ultra wide angle, pincushion lens effect 
a photo of a man dressed as an angel_____angel wearing armor holding a sword illustration by maxfield parrish, greg manchess, mucha 
a photo of a tank on a dirt road_____tanks driving down a dirt road 
a photo of two people in gas suits_____two time generals wearing flight masks and red rick owens flight suits with their hands behind their backs inside the glowing geometric rainbow portal to the sixth dimension by frank frazetta 
a photo of two dolls dressed as princesses_____highly detailed closeup, face profile portrait of a tin toy fairytale princess wearing a crown eating cakes, bikini, unreal engine, nicoletta ceccoli, mark ryden, earl norem, lostfish, global illumination, detailed and intricate environment 
a photo of a teddy bear sitting on a rock_____8 k made in abyss chubby, teddy bear, wearing military uniform, bloody sharp teeth, devilish grin, red sky, halo reissuance sitting on a throne, bara, in the style of caravaggio, akihito tsukashi n 
a photo of a man with a beard and a white beard_____harrison ford by kehinde wiley and rembrandt : 5. photorealistic facial features, portrait, detailed face, ultra high details, large, close - up : 1 5. 
a photo of a woman in a golden dress_____beautiful viking woman surrounded by treasure and gold, perfect face, wearing a golden robe, cat in background, tom bagshaw 
a photo of a desert with a spaceship_____industrial spaceport on a vast desert planet with ships taking off, by ralph mcquarrie, digital painting, highly detailed 
a photo of a man in a suit and helmet standing in front of a mountain_____by 3 4 3 industries 
a photo of a man in a suit and tie_____a painting by edward hopper of a man holding hand pointing towards the sky with two big bright purple eyes. it has a halo around it and a glow around it. 
a photo of a woman with many different body types_____a hyperdetailed character design opulent, elderly grandmaster, fumo yoshitoshi, chinese mythology, ren jing jeong, peter mohrbacher, biomehieronymus spang, arunanondchai, murals, ocohopebright, pg 1 4 8, veileducationary, esllection, warrior, dreamcore, hyper detailed digital art, chinese style, vic
a photo of a man with a face made out of shredded paper_____unholy servant, digital collage, assemblage, photomontage, minimalist, contemporary art, punk art, photorealistic, portrait, expressionism, masterpiece, dynamic composition, spectacular quality, intricate oil details, shattered glass texture, neon, chains, smoke 
a photo of a pig_____realistic pig - dog creature cinematic 3 5 mm 
a photo of a corgy corgy enamel enamel pin_____corgi puppy, realistic, adorable, happy, enamel pin 
a photo of a woman walking down a path in the woods_____adorable studio ghibli anime girl walking in the forest on a sunny day, pastel colors 
a photo of a quote that says,'win '_____when the truth within dies 
a photo of a man in a suit and boots_____dark enlightenment, full length body portrait of a sci - fi pilot, painted by zdzislaw beksinski, jack kirby, tom lovell, alex malveda, greg staples 
a photo of a giant robot in a futuristic environment_____mount epic antoran hounds screenshot world of warcraft mounts worldboss bioluminecant light concept sketch art and by feng zhu alena aenami artworks in 4 k beeple, by thomas kinkade heartstone overwatch blizzard 3 d rtx hdr 
a photo of a painting of a woman_____nuclear weapon, art by kandinsky 
a photo of a girl sitting at a table with a cup of coffee_____studio ghibli anime, adorable woman with a drink sitting in a rainbow cafe 
a photo of a painting of a garden with lanterns_____beautiful garden at twilight by annie swynnerton and nicholas roerich and jean delville, glowing paper lanterns, strong dramatic cinematic lighting, ornate tiled architecture, lost civilizations, smooth, sharp focus, extremely detailed 
a photo of a robot with a green eye_____doom eternal, game concept art, muscular, exoskeleton, chiroptera head, chiroptera ears, shark teeth, hyperrealism, fine details, artstation, cgsociety, zbrush, no background 
a photo of a demonic monster with glowing eyes and a glowing head_____mount epic mechanostriders screenshot world of warcraft mounts worldboss bioluminecant light concept sketch art and by feng zhu alena aenami artworks in 4 k beeple, by thomas kinkade heartstone overwatch blizzard 3 d rtx hdr 
a photo of a bunch of different people_____2 d character design, male rapper, vector art, digital art, portrait, 4 k, 8 k, sharp focus, smooth, illustration, concept art, music artist 
a photo of three toy characters standing in front of a purple sky_____album cover art teletubbies 
a photo of robots in a room_____robots creating new robots in a factory, oil painting by justin gerard, deviantart, blizzard, bright colors 
a photo of a man in a red jacket_____george washington by kehinde wiley and rembrandt : 5. photorealistic facial features, portrait, detailed face, ultra high details, large, close - up : 1. 
a photo of a rainbow in the sky_____by john harris 
a photo of a building with trees and flowers_____beautiful ancient temple in a formal garden. by edmund dulac and maxfield parrish and nicholas roerich and andreas rocha. ornate carvings, geometric decorations. rich color. dramatic cinematic lighting with god rays. extremely clear and detailed. cell shaded. dynamic composition 
a photo of a woman holding a bouquet_____emily wickersham as natalie portman, greg manchess, mucha 
a photo of a woman in a white dress_____john singer sargent maxfield parrish, greg manchess, mucha 
a photo of a woman with a futuristic face_____beautiful topaz girl dark. artstation hq. intricate, elegant.. decollage. by giger 
a photo of a robot with a red light on his face_____doom slayer, sci - fy armor, dramatic, grimdark, gothic, painted by stanley lau, painted by greg rutkowski, painted by stanley, artgerm, masterpiece, digital art, trending on arts 
a photo of a robot with glowing green eyes_____doom eternal, game concept art, muscular, exoskeleton, chiroptera head, chiroptera ears, hyperrealism, fine details, artstation, cgsociety, zbrush, no background 
a photo of a monkey holding a banana_____anthropomorphic pine marten animal, dressed as a rave dancer, character sheet, concept design, contrast, hot toys, kim jung gi, greg rutkowski, zabrocki, karlkka, jayison devadas, trending on artstation, 8 k, ultra wide angle, pincushion lens effect 
a photo of a futuristic city with a futuristic car in the middle_____a beautiful ultradetailed anime illustration of industrial architecture cavern abandoned urbex by april gornik, evil cyberpunk postcyberpunk extraterrestial water at spring bladerunner 2 0 4 9 azeroth landscape retro jupiter universe junglepunk, archdaily, wallpaper, highly detailed, trending on artstation. 
a photo of a woman with long hair_____painted closeup portrait of intense woman, fierce, fantasy, intricate, elegant, extremely detailed by by chuck close, charcoal on canvas 
a photo of a waterfall in the mountains_____render of rivendell dreamy beautiful landscape, dreamy, artger, large scale, details vintage photo hyper realistic ultra realistic photo realistic photography, unreal engine, high detailed, 8 k 
a photo of a dinosaur and a dinosaur in the movie_____dinoriders realistic cinematic 3 5 mm 
a photo of a person standing in front of a colorful wall_____a man looking at the brightly lit screen of smartphone slave of smartphone. artstation hq. by eduardo paolozzi. cgsociety. cyberpunk. volumetric light. anti - utopia. by affandi. 
a photo of a woman in a spaceship_____a beautiful painting of atompunk girl by nekro and pascal blanche and syd mead and greg rutkowski and sin jong hun and victo ngai and simon stalenhag and ansel adams. in style of cg art. ray tracing. cel shading. hyper detailed. realistic. ue 5. maya. octane render. 
a photo of a woman's face_____sketchbook pages copic markers, magnificent, close up, details, sharp focus, beauty girl asian, sexy, hyper detailed, insane details, intricate, elite, elegant, luxury, by ismail inceoglu dragan bibin hans thoma greg rutkowski alexandros pyromallis rene maritte illustrated, perfect face, fine details, realistic shaded, fine - face, pretty face 
a photo of a boy with a jacket_____portrait painting of a lost boy by cedric peyravernay and greg ruthkowski, in the style of dishonored concept art, concept design, trending on artstation 
a photo of frogs and flowers on a purple background_____1 0 0 frogs digital art 
a photo of a woman with long hair and a flower in her hair_____victo ngai girl succubi sticker decal design, highly detailed, high quality, digital painting, by ross tran and studio ghibli and alphonse mucha, artgerm 
a photo of a river surrounded by trees_____render of beautiful landscape, dreamy, by herbaceous plants, artger, followed by conifers and temperate, details vintage polaroid photo hyper realistic ultra realistic photo realistic photography, prehistoric by bellotto bernardo, unreal engine, high detailed, 8 k 
a photo of a vampire with fangs and fangs_____portrait of a cloaked female devil, evil, laughing, pointy teeth, stunning, detailed, by artgerm, by greg rutkowski, by luis royo, by pixar, by myazaki, gothic, final fantasy, fantasy, medieval 
a photo of three women in white dresses_____portrait of two young beautiful gorgeous captivating shapely german latvian belarusian finnish norwegian swedish glamour models in ballet room, jodhpurs greg manchess painting by sargent and leyendecker, studio ghibli close - up asymmetrical intricate elegant illustration hearthstone, by greg rutkowski by greg tocchini by james gilleard 
a photo of a black cat with a blue bow tie_____a blue - eyed black siamese cat wearing a bowtie, by makoto shinkai, greg rutkowski, artstation, high detailed, cgsociety, 
a photo of a woman doing yoga in a japanese garden_____linares model with blue hair demonstrating headstamd yoga pose in japanese gazebo floating on a lake in the moonlight with cherry blossoms 
a photo of a yellow and black painting_____abstract landscape spray painting, blurry horizontal lines, yellow and black, by sterling ruby, 
a photo of a long hallway with a clock_____quandale dingle in a dim hallway 
a photo of a person walking down a street with a dog_____a wholesome animation key shot of the village of the cat - people, colorful flags, deep forest, studio ghibli, pixar and disney animation, sharp, disney concept art watercolor illustration by mandy jurgens and alphonse mucha and alena aenami, pastel color palette, dramatic lighting 
a photo of a man with a beard and a black and white image_____harrison ford by kehinde wiley and rembrandt. photorealistic facial features, portrait, detailed face, ultra high details, large, close - up. 
a photo of a person walking through a forest with a fire in the background_____a woman setting fire to the dead forest with her footsteps realistic cinematic 3 5 mm 
a photo of a futuristic city with trees and buildings_____unfinished building by frank gehry, elysian fantasy san andreas wilderness crystal water synthwave sunny studio ghibli vice city rainforest universe darkacademia cyberpunk atlantis evil thermal imaging cosmic fisheye morning sun myst scumm bar, archdaily, wallpaper, highly detailed, trending on artstation. 
a photo of a face made out of broken glass_____she chained in neon chains, digital collage, decoupage, assemblage, photomontage, canvas texture, minimalist, contemporary art, punk art, photorealistic, portrait, expressionism, masterpiece, dynamic composition, spectacular quality, intricate oil details, broken glass 
a photo of two children walking in the rain_____a wholesome animation key shot of a child running in the rain holding an umbrella, japanese village, studio ghibli, pixar and disney animation, sharp, disney concept art watercolor illustration by mandy jurgens and alphonse mucha and alena aenami, pastel color palette, dramatic lighting 
a photo of halo halo halo halo halo halo halo halo halo halo halo halo halo halo halo halo_____screenshot of halo by weta 
a photo of a man in a wheelchair on the beach_____robocop in a wheelchair at the beach, movie still, 8 k 
a photo of a flower with a purple background_____invocations unto the yaohu yanshi and the lupercalic secret histories : paw walker anthropicon ergo licht : the way of the tail, fang, and claw | when the stars fall all will hear fenrir's howl ðŸŒŒ ðŸ™Œ cry wolf - blessed beasts burn babylon | | whom spake? weasel wordsmith, wigglesome pest 
a photo of a spaceship flying over a desert_____industrial spaceport on a vast desert planet with ships taking off, by ralph mcquarrie, digital painting, highly detailed 
a photo of a painting of a group of people_____robots in disguise, baroque painting, oil painting, classicism, high renaissance 
a photo of a couple of people standing in front of a car_____a still of breaking bad, but it's a pixar movie from 2 0 2 2 
a photo of a person with a cross on his chest_____highly detailed magician god holding a divine staff character design, cyberpunk crystal helmet and armor, cape, warframe, magician style, cyberpunk, elegant, highly detailed, ray tracing, smooth, sharp focus, art by fenghua zhong, peter mohrbacher, ruan jia, liuyuan lange, akiya kageichi, ayami kojima, joseph leyendecker 
a photo of a woman with her face covered in water_____hyperrealistic ultradetailed portrait of a crying philippine character in a scenic environment, war, flowers, rain, by beksinski zdzislaw, yoro sean, buchholz, quint, christensen james c., 
a photo of a man in a purple suit standing on a mountain_____mount epic battle gargon vrednic screenshot world of warcraft mounts worldboss fantasy comics that looks like it is from borderlands by jesper ejsing, by rhads, makoto shinkai alena aenami artworks in 4 k beeple, thomas kinkade heartstone league of legends dofus overwatch 
a photo of a futuristic city with palm trees_____landscape by zaha hadid, elysian retrowave morning sun universe vice city at night reclaimed by nature uv light neon signs at fall vaporwave, archdaily, wallpaper, highly detailed, trending on artstation. 
a photo of a cat sitting on a couch_____a painting by edward hopper of a cat sitting on a dog's head and looking at the universe 
a photo of a building with a large window_____a beautiful detailed illustration of bunker architecture city unfinished building nature abandoned industrial architecture urbex building by vincent van gogh, wilderness desert nature retro elysian hyperrealism bioshock extraterrestial studio ghibli neon signs darkacademia thermal imaging, archdaily, wallpaper, highly detailed, trending on artstation. 
a photo of monsters playing chess_____monsters playing board games, oil painting by justin gerard, deviantart, pixar, bright colors 
a photo of a city with many buildings_____new york city building abstract geometric colorful render ðŸ›° 
a photo of two soap bubbles on a sidewalk_____hyperrealistic bubble containing bubbles coloured bright light reflections photograph cinematic 3 5 mm 
a photo of two women in dresses and umbrellas_____jetsons disney fantasy art girl professional photo shoot, gothic dress, suggestive classic painting 
a photo of a demonic creature with red flames_____a void colossus with shadowy tendrils and piercing red eyes creeping through a white background, grunge, artstation, high quality, hyper detailed 
a photo of a person with a cross on his back_____sculpture angel wearing armor holding a sword illustration by maxfield parrish, greg manchess, mucha 
a photo of a woman with a cat_____beautiful viking woman surrounded by treasure and gold, perfect face, green eyes, wearing an ornate golden robe, two cats in background, tom bagshaw 
a photo of a monster with its mouth open_____happy monsters, oil painting by justin gerard, deviantart, pixar, blizzard, bright colors 
a photo of a forest with a large tree in the middle_____photo cartoon bd illustration comic manga painting of jungle environement : 5 fantasy environement, digital painting : 1 fat brush concept sketch artist bd enki bilal : 1 0 
a photo of a man in uniform_____a portrait of a military general with a steampunk prosthetic arm, victorian nobility, highly detailed 
a photo of a building with lots of windows_____a beautiful detailed anime illustration of city industrial architecture urbex home office by federico babina, at dawn poppy evil desert retrowave neon noir steampunk nature scumm bar reclaimed by nature gem futuristic neon signs extraterrestial sunset matte painting anime otherworldly cgsociety, archdaily, wallpaper, highly detailed, trending on artstation. 
a photo of a giant monster with a large mouth_____landscape, realistic portrait beautiful painting from scene in terminator robot merged in kingkong, merged in godzilla, merged in t - rex, fighting movie scene, hyperdetailed retrofuturism created by thomas kinkade and gustave courbet, fine draw, high detailed, fine lighting, smooth draw, no anomaly. 
a photo of a predator with a red background_____doom eternal, game concept art, muscular, exoskeleton, chiroptera head, chiroptera ears, shark teeth, ferocious, hyperrealism, fine details, artstation, cgsociety, zbrush, no background 
a photo of a woman with red hair and horns_____portrait of a cloaked female devil, evil, ominous, luscious, ginger hair, stunning, detailed, by artgerm, by greg rutkowski, by luis royo, by pixar, by myazaki, gothic, final fantasy, fantasy, medieval 
a photo of a doctor_____horror movie still, italian berlusconi as a cyberpunk zombie in med lab, full of medical wires, batteries, tech and drips 
a photo of a painting of a woman with a red eye_____a painting by edward hopper of a young woman in a floral dress. she has blue lines down her face, black hair and piercing eyes 
a photo of a sticker with a woman in a green dress_____victo ngai girl viking sticker decal design, highly detailed, high quality, digital painting, by ross tran and studio ghibli and alphonse mucha, artgerm 
a photo of a woman with flowers in her hair_____victo ngai girl succubi sticker decal design, highly detailed, high quality, digital painting, by ross tran and studio ghibli and alphonse mucha, artgerm 
a photo of a city with a lot of trees and people walking around_____a beautiful painting of pripyat in autumn by nekro and pascal blanche and syd mead and greg rutkowski and sin jong hun and victo ngai and simon stalenhag and chris voy. in style of cg art. ray tracing, cel shading, 3 d. ue 5. hyper detailed. realistic. maya. octane render. 
a photo of a cliff with a waterfall in the middle_____a beautiful very detailed painting of city building unfinished building architecture abandoned canyon nature urbex by lee madgwick, futuristic extraterrestial landscape atlantis evil darkacademia biopunk apocalyptic matte painting, archdaily, wallpaper, highly detailed, trending on artstation. 
a photo of dart and dart sit in front of a table_____jabba the hut and darth vader playing d & d in their moms basement in the late 1 9 8 0 s, movie still, hd 
a photo of a group of foxes_____anthropomorphic foxes animals, dressed as raver chicks dancers, dance club in tropical paradise, many woodland creatures dancing, concept design, contrast, hot toys, kim jung gi, greg rutkowski, zabrocki, karlkka, jayison devadas, trending on artstation, 8 k, ultra wide angle, pincushion lens effect 
a photo of a man with a beard and a beard_____by concept artists at league of legends 
a photo of a mansion in the middle of a forest_____a beautiful detailed highly detailed nature museum unfinished building industrial architecture building by edward hopper, elysian synthwave scumm bar wilderness futuristic desert forest extraterrestial water tundra bioshock san andreas galactic nature meadow sea cgsociety fantasy otherworldly, archdaily, wallpaper, highly detailed, trending on artstation. 
a photo of a woman singing into a microphone_____a gummy bear performing at woodstock concert. 3 5 mm film, 
a photo of a cartoon character in a red shirt and blue jeans_____a screenshot of daniel radcliffe in the video game simpsons hit and run. 3 d rendering. unreal engine. amazing likeness. very detailed. cartoon caricature 
a photo of a colorful sculpture in the middle of a city_____portrait of haribo bear in future city, color and shape focus, central composition, n 
a photo of a dog_____west hightland white terrier, sweet, affectionate, tender, cute, watercolor painting 
a photo of a person in a forest_____anthropomorphic racoon animal, dressed as a raver chick dancer, dance club in the forest, many woodland creatures dancing, concept design, contrast, hot toys, kim jung gi, greg rutkowski, zabrocki, karlkka, jayison devadas, trending on artstation, 8 k, ultra wide angle, pincushion lens effect 
a photo of a nuclear plant in the middle of a field_____a beautiful painting of chernobyl in autumn by nekro and pascal blanche and syd mead and greg rutkowski and sin jong hun and victo ngai and simon stalenhag and chris voy. in style of cg art. ray tracing, cel shading, 3 d. ue 5. hyper detailed. realistic. maya. octane render. 
