a photo of two people in a room_____a charming illustration of two young high school sweethearts set in a school setting, concept art, digital painting, trending on artstation hq, deviantart, pinterest, unreal engine 5, 
a photo of a city with a river and a man in a boat_____landscape by banksy, made of glass, archdaily, wallpaper, highly detailed, trending on artstation. 
a photo of a girl with long hair_____anime cartoon of a face portrait of a cute girl with pigtails, bikini, nicoletta ceccoli, mark ryden, lostfish, max fleischer, hyper realistic, artstation, illustration, digital paint, matte paint, vivid colors, bright, cheerful, detailed and intricate environment 
a photo of a demon with a demon head on it's back_____symmetry!! a tiny cute chinese spring festival oriental tale mascot snake - phoenix toys, magic, intricate, smooth line, light dust, mysterious dark background, warm top light, hd, 8 k, smooth ï¼Œ sharp high quality artwork in style of greg rutkowski, concept art, blizzard warcraft artwork, bright colors 
a photo of a painting of people in a room_____a painting by edward hopper of a group of men that are wearing spacesuits and the composition of the spacecraft is that of a planet. 
a photo of a bear on a building_____portrait of haribo bear in future city, 
a photo of two men in the desert_____a strange man creature trying to put suncream on his own back realistic cinematic 3 5 mm 
a photo of two women standing on a hill with the sun shining behind them_____the prince of the sun, volumetric lighting, crepuscular rays and light scattering by greg rutkowski, tony sart and sylvain sarrailh, conceptartworld rendered in oil on canvas 
a photo of a dragon with red light_____symmetry!! a tiny cute chinese spring festival oriental tale mascot wolf - phoenix toys, magic, intricate, smooth line, light dust, mysterious dark background, warm top light, hd, 8 k, smooth ï¼Œ sharp high quality artwork in style of greg rutkowski, concept art, blizzard warcraft artwork, bright colors 
a photo of a man with a gun_____concept art of a citizen of the apocalypse, by ralph mcquarrie, concept art, highly detailed 
a photo of a man with white hair and a beard_____white haired robe fu xi full male body portrait, sit upright on the ground, very long white beard and hair, fine kindness delicate prefect face features gaze, piercing eye, elegant, smooth, style of tom bagshaw, cedric peyravernay, peter mohrbacher, victo nga, 4 k hd illustrative wallpaper, animation style, chinese style 
a photo of a room with a view of trees_____a beautiful detailed highly detailed nature city sunroom architecture urbex unfinished building by diebedo francis kere, gem hyperrealism, archdaily, wallpaper, highly detailed, trending on artstation. 
a photo of an angel holding a sword_____angel holding a sword illustration by maxfield parrish, greg manchess, mucha 
a photo of two men standing next to a car_____bill gates and jason statham fight m 
a photo of a painting of a house_____minimalist summertime architecture by atey ghailan ( ( and edward hopper ) ) 
a photo of a group of llamas walking in the snow_____a beautiful paint of cultists dancing surrounds a huge alpaca in desert at night, by zdzislaw beksinski, trending on artstation. 
a photo of a cartoon character floating in a space_____baby groot lies flat in bed the space ship, by victo ngai 
a photo of a machine with a bunch of flowers_____overcook videogame in the style of hr giger 
a photo of a city with a train track_____a beautiful painting of the heart of pripyat by nekro and pascal blanche and syd mead and greg rutkowski and beeple and victo ngai and simon stalenhag and chris voy. in style of cg art. ray tracing, cel shading, 3 d. ue 5. hyper detailed. realistic. maya. octane render. 
a photo of a woman in a pink dress_____a painting by edward hopper of a girl in a forest, dark surrealism 
a photo of a waterfall in the jungle_____reclaimed by nature by kazuyo sejima, sea atlantis hyperrealism junglepunk, archdaily, wallpaper, highly detailed, trending on artstation. 
a photo of a panda bear dressed as a chinese god_____symmetry!! a tiny cute chinese spring festival oriental tale mascot panda - lion toys, magic, intricate, smooth line, light dust, mysterious dark background, warm top light, hd, 8 k, smooth ï¼Œ sharp high quality artwork in style of greg rutkowski, concept art, blizzard warcraft artwork, bright colors 
a photo of a city with a lot of buildings_____a beautiful detailed painting of alley urbex architecture city by jacob van ruisdael, crystal flowers architecture island retrowave at night at dusk neon noir apocalyptic forest magic realism at spring rainforest, archdaily, wallpaper, highly detailed, trending on artstation. 
a photo of a woman with red flowers_____hyperrealistic portrait of a philippine character in a scenic environment, war, flowers, rain, by beksinski zdzislaw, yoro sean, buchholz, quint, christensen james c., 
a photo of a soldier in a desert_____by 3 4 3 industries 
a photo of two robots, one with a green and white face_____robots creating new robots, by ryan meinerding 
a photo of a futuristic city with a giant tower_____a time machine creating a utopia. highly detailed, digital painting, loose brush strokes, realistic shaded lighting, artstation, concept art, smooth, sharp focus, illustration, realism, oil painting, unreal engine 5, 8 k, art by peter mohrbacher and sam spratt, grey rutkowski, iris van herpen, 
a photo of a girl holding a drink and a cat_____ghibli style half cat half kpop idol with blue fur woman wearing a pink dress eating a popsicle. 
a photo of a woman with long hair_____beautiful lee jin eun with interstellar hair, soft lighting, realistic wide angle, wonderful lips and eyes, white skin, sharp focus, 8 k high, 6 4 megapixel, insanely detailed, intricate, elegant, art by greg rutkowski and wlop 
a photo of a house with a lot of junks on the roof_____photo cartoon bd illustration comic manga painting of garage environement : 5 fantasy environement, digital painting : 1 fat brush concept sketch artist bd enki bilal : 1 0 
a photo of a woman leaning on a car_____porsche by maxfield parrish, greg manchess, mucha 
a photo of a field with a cloudy sky_____snowing meadow with many black flowers in front, wide angle, sad feeling, in style of john harris, watercolor, artstation 
a photo of the three heroes of the league league league league league league league league league league league_____by concept artists at blizzard 
a photo of a predator with a red background_____doom eternal, game concept art, muscular, exoskeleton, chiroptera head, chiroptera ears, shark teeth, hyperrealism, fine details, artstation, cgsociety, zbrush, no background 
a photo of a deer in the woods_____the last silver horned stag, volumetric lighting, crepuscular rays and light scattering by greg rutkowski, tony sart and sylvain sarrailh, conceptartworld rendered in oil on canvas 
a photo of a man in a suit standing in a hallway_____concept art of a silent hill monster. painted by edward hopper. 
a photo of a gi_____painted closeup portrait of hyena man, masculine, young, charming, majestic, fantasy, intricate, elegant, extremely detailed digital painting, concept art, sharp focus illustration art by alphonse mucha, charcoal on canvas 
a photo of the joker in the joker movie_____movie still of the joker on american psycho ( 2 0 0 0 ) 
a photo of a pool with a deck and a deck_____dream swimming pool with nobody 
a photo of a forest with a river in the middle_____render of dreamy beautiful landscape, fantasy dreamy, yellow, artger, large scale, details vintage photo hyper realistic ultra realistic photo realistic photography, unreal engine, high detailed, 8 k 
a photo of a woman sitting in a room_____a painting by edward hopper of psychedelic creatures that seem to communicate with the viewer 
a photo of a futuristic building with trees in the background_____zaha hadid, archviz, 8 k, 3 d, hyper detailed, archviz, hyper realism, octane render, unreal engine, zbrush, dramatic lighting, concept art, a beautiful massive outdoor amphitheater in the future 
a photo of a demonic demon with red eyes_____a void beast with shadowy tendrils and piercing red eyes creeping through a white world, grunge, artstation, high quality, hyper detailed 
a photo of chew chew from the star wars_____concept art of chewie by ralph mcquarrie, digital painting, highly detailed 
a photo of a man with flowers in his hair_____hyperrealistic portrait of a philippine character in a scenic environment, flowers, rain, war, by beksinski zdzislaw, yoro sean, buchholz, quint, christensen james c., 
a photo of some of the concept art for the game_____by concept artists at bungie 
a photo of a samurai riding on a horse_____a hyperdetailed character design opulent, elderly grandmaster, fumo yoshitoshi, chinese mythology, ren jing jeong, peter mohrbacher, biomehieronymus spang, arunanondchai, murals, ocohopebright, pg 1 4 8, veileducationary, esllection, warrior, dreamcore, hyper detailed digital art, chinese style, vic
a photo of two people standing in a tunnel_____the emperors of time wearing techno visors and red rick owens flight suits with their hands behind their backs inside the glowing geometric rainbow portal to the sixth dimension by frank frazetta 
a photo of the heroes of the game heroes of the storm_____by concept artists at league of legends 
a photo of a dog made out of paper_____realistic corgi, intricate paper quilling, swirls, spirals, white background 
a photo of a skull with a gun in its hand_____a beautiful painting of cyberpunk skull by nekro and pascal blanche and syd mead and greg rutkowski and sin jong hun and victo ngai and simon stalenhag and chris voy. in style of cg art. ray tracing, cel shading, 3 d. ue 5. hyper detailed. realistic. maya. octane render. 
a photo of a boy sitting at a table with a camera_____coherent, science fiction, retrofuturistic awkward lonely brilliant female blond teenage tomboy girl with very short messy hair, round dark goggles, sitting at table building a radio, nostromo, studio ghibli, pixar and disney animation, sharp, disney concept art watercolor illustration by mandy jurgens and alphonse mucha and alena aenami, pastel color palette, dramatic lighting, highly detailed 
a photo of a woman with dark hair and a black dress_____an emo portrait painting. short dark brown messy pixie haircut, large black eyes, antichrist eyes, slightly rounded face, pointed chin, thin lips, small nose, black tank top, black leather jacket, black knee - length skirt, black choker, gold earring, by peter mohrbacher, by rebecca guay, by ron spencer 
a photo of a cat with yellow eyes_____high quality simplified rectangular logo of a medieval stone blacksmith forge shaped like a realistic cat head looking at viewer, for a company called poly - forge, symmetrical!!!, award winning, art deco!!!!!! by milton glaser 
a photo of a factory with a bunch of gums_____a gummy bear manufacturing factory 
a photo of a city with trees growing on the buildings_____a sustainable mixed - use post - modern post - growth walkable solarpunk urban development. 
a photo of a girl with a pink hair and a blue jacket_____kpop idol woman dressed in pink, eating a sucker, vaporwave style pastel colors 
a photo of a woman with a pink and black face_____girl from fight club, digital collage, assemblage, photomontage, minimalist, contemporary art, punk art, photorealistic, portrait, expressionism, masterpiece, dynamic composition, spectacular quality, intricate oil details, shattered glass texture, neon, chains, smoke 
a photo of a jungle scene with a man in the middle of the jungle_____architecture by henri rousseau, rainforest sunset neon noir scumm bar morning sun infrared bladerunner 2 0 4 9 wilderness neon signs lake magic realism alien nature meadow thermal vision reclaimed by nature tundra anime myst hyperrealism vaporwave forest assassin's creed, archdaily, wallpaper, highly detailed, trending on artstation. 
a photo of a woman with a red lipstick_____a portrait painting. short dark brown messy pixie haircut, large black eyes, antichrist eyes, slightly rounded face, pointed chin, thin lips, small nose, black tank top, black leather jacket, black knee - length skirt, black choker, black leather jacket, by oskar schlemmer, oil on canvas, edward hopper, don martin, ludwig deutsch 
a photo of a man in a suit and hat writing_____a painting by edward hopper of a man in a suit and hat looking up from the page. 
a photo of a man walking through a tunnel_____photograph, futuristic scene, interstellar, brutalist style architecture, straight edges, space, finely detailed oil painting, impasto brush strokes, soft light, 8 k, dramatic composition, dramatic lighting, sharp focus, octane render, masterpiece, by adrian ghenie and jenny saville and zhang jingna 
a photo of a woman with long hair and a hat_____victo ngai girl viking sticker decal design, highly detailed, high quality, digital painting, by ross tran and studio ghibli and alphonse mucha, artgerm 
a photo of a citysca with buildings and neon lights_____building by denise scott brown, tron tokyo anime at night alien flowers cgsociety nightvision at dusk nightsky sunlight dramatic lighting fisheye studio ghibli cyberpunk at dawn rainforest thermal vision thermal imaging reclaimed by nature darkacademia myst meadow retrowave landscape, archdaily, wallpaper, highly detailed, trending on artstation. 
a photo of a woman in a forest with animals_____anthropomorphic racoon animal, dressed as a raver chick dancer, dance club in the forest, many woodland creatures dancing, concept design, contrast, hot toys, kim jung gi, greg rutkowski, zabrocki, karlkka, jayison devadas, trending on artstation, 8 k, ultra wide angle, pincushion lens effect 
a photo of a city with a lot of buildings_____industrial architecture by zack snyder, atlantis at dawn laser meadow wilderness sunlight neon noir architecture island sunset tundra futuristic alien cosmic hyperrealism fisheye at dusk assassin's creed, archdaily, wallpaper, highly detailed, trending on artstation. 
a photo of a dog with a dumbble_____a dog doing weights. epic oil painting. 
a photo of a spaceship flying over a desert_____spaceport on a vast desert planet with ships taking off, by ralph mcquarrie, digital painting, highly detailed 
a photo of a tall building with many windows_____a beautiful very detailed render of architecture building urbex industrial architecture city fort by federico babina, at night junglepunk infrared, archdaily, wallpaper, highly detailed, trending on artstation. 
a photo of a woman with a sword_____victo ngai cute girl paladin sticker decal design, highly detailed, high quality, digital painting, by ross tran and studio ghibli and alphonse mucha, artgerm 
a photo of a woman with a cat_____beautiful viking woman surrounded by treasure and gold, perfect face, green eyes, golden robe, two cats in background, tom bagshaw 
a photo of the tara nebula_____a nebula in the night sky, hubble space telescope, astral photography 
a photo of a woman in a red dress standing in a cave_____flying alien in a medieval dungeon, luscious, seductive, temptress, red armor, stunning, detailed, by artgerm, by greg rutkowski, by luis royo, by pixar, by myazaki, gothic, final fantasy, fantasy, medieval 
a photo of a woman wearing boxing gloves_____anime girl with muscles with boxing gloves, highly detailed, muscular, very beautiful face, digital art, pixiv fanbox, artstation, by greg rutkowski, wlop, miyazaki hayao 
a photo of a man taking a picture of a person_____film still by 3 4 3 
a photo of a city with trees and buildings_____a beautiful painting of pripyat in autumn by pascal blanche and syd mead and greg rutkowski and sin jong hun and victo ngai and simon stalenhag and chris voy. in style of cg art. ray tracing, cel shading, 3 d. ue 5. hyper detailed. realistic. maya. octane render. 
a photo of a dragon with a fire in its mouth_____book cover illustration, art by gerald brom, of a flying medieval fantasy dragon breathing fire upon a stone brick castle, oil painting, cinematic, ultradetailed, comfy, dreamlike, ethereal, high readability 
a photo of a man and woman sitting at a table_____iconic movie stills from david lynch's twin peaks, painted by edward hopper, oil on canvas painting, american realism, highly detailed. 
a photo of a woman with a creepy face_____painted closeup portrait of intense woman, fierce, fantasy, intricate, elegant, extremely detailed by chuck close, charcoal on canvas 
a photo of a fox wearing a hoodie_____oil painting portrait of anthropomorphic female green fox animal, dressed in black hoodie. fox animal, glowing eyes, oil painting, angry, 
a photo of a woman in a hat_____emily wickersham as natalie portman, maxfield parrish, greg manchess, mucha 
a photo of a woman in a costume_____portrait of a dancing eagle woman, beautiful blonde haired lakota sioux goddess, intricate, highly detailed art by james jean, ray tracing, digital painting, artstation, concept art, smooth, sharp focus, illustration, artgerm and greg rutkowski and alphonse mucha, vladimir kush, giger 8 k 
a photo of a painting of a woman holding a bat_____a painting by edward hopper of a bird with a staff 
a photo of a man riding a jet ski_____riding a jetski, the jetski is a dolphin, going way too fast, cartoon 
a photo of a man with a very wrl face_____harrison ford by kehinde wiley and rembrandt : 5. photorealistic facial features, portrait, detailed face, ultra high details, large, close - up : 5 0. 
a photo of a city with a green roof_____a beautiful hyperdetailed highly detailed nature playground city building by john howe, poppy uv light darkacademia at dusk sea sunlight liberty city, archdaily, wallpaper, highly detailed, trending on artstation. 
a photo of two women in red_____only with red, a creepy red man in symbiosis with technology, red wires attack, in a red laboratory red flies, dorohedoro vibes, in the style of beksinski, parts by edward hopper, parts by michael sowa, parts by yue minjun, intricate composition, red by caravaggio, highly quality, highly detailed, masterpiece, red light, artstation,
a photo of a painting of a castle_____ancient temple by a lake. by edmund dulac and maxfield parrish and nicholas roerich. ornate carvings, climbing vines. rich color. dramatic cinematic lighting with god rays. extremely clear and detailed. 
a photo of a man with long hair and beard_____painted closeup portrait of tree man, masculine, fierce, charming, majestic, fantasy, intricate, elegant, extremely detailed digital painting, concept art, sharp focus illustration art by alphonse mucha by chuck close, charcoal on canvas 
a photo of a woman in a kimono_____a stunning portrait of an asian samurai with long black hair by artgerm, dynamic lighting, ray tracing, tom bagshaw, alphonse mucha, donata giancola, mary jane ansell, ankh necklace, atmosphere, realism, octane render, dof, hyperdetailed, 8 k 
a photo of a man in a red robe holding a knife_____hyperrealistic portrait of a crying philippine character in a scenic environment, war, flowers, rain, by beksinski zdzislaw, yoro sean, buchholz, quint, christensen james c., 
a photo of a robot in a red background_____doom eternal, game concept art, wires fused with body, muscular, crustacean exoskeleton, chiroptera head, chiroptera ears, shark teeth, ferocious, fierce, hyperrealism, fine details, artstation, cgsociety, zbrush, no background 
a photo of a woman in a dress_____a southern war belle during the civil war in front of a plantation house, pointing a shotgun at the camera old fashioned photo sepia 
a photo of a person in a blue dress_____anthropomorphic blue cat woman dressed in pink, vaporwave style pastel colors 
a photo of a futuristic city with lots of buildings_____a beautiful very detailed rendering of palace city unfinished building nature urbex industrial architecture by renzo piano, at night futuristic extraterrestial junglepunk, archdaily, wallpaper, highly detailed, trending on artstation. 
a photo of a painting of a garden with flowers_____beautiful garden at twilight by annie swynnerton and nicholas roerich and jean delville, glowing paper lanterns, strong dramatic cinematic lighting, ornate tiled architecture, lost civilizations, smooth, sharp focus, extremely detailed 
a photo of two people in black and white costumes_____two time pilots wearing flight masks and red rick owens flight suits inside the glowing geometric rainbow portal to the sixth dimension by frank frazetta 
a photo of monsters in a cave_____monsters playing soccer, oil painting by justin gerard, deviantart, pixar, bright colors 
a photo of a woman with red hair and a black angel wings_____portrait of a cloaked female devil, demoness, evil, ominous, luscious, ginger hair, stunning, detailed, by artgerm, by greg rutkowski, by luis royo, by pixar, by myazaki, gothic, final fantasy, fantasy, medieval 
a photo of a man with long hair_____robert pattinson with gorgeous long hair in trenchcoat with magical glowing hands, digital painting, d & d, fantasy, highly detailed, digital painting, trending on artstation, concept art, sharp focus, illustration, global illumination, shaded, art by artgerm and greg rutkowski and fuji choko and viktoria gavrilenko and hoang lap 
a photo of two whales in the ocean_____render of dreamy beautiful landscape, fantasy flying whale, dreamy, artger, large scale, details vintage photo hyper realistic ultra realistic photo realistic photography, unreal engine, high detailed, 8 k 
a photo of a woman in a white dress_____angel john singer sargent, maxfield parrish, greg manchess, mucha 
a photo of a desert with sand dunes_____sustainable fabrics flowing on sand 
a photo of a woman in a dark cave_____female demon in a medieval dungeon, glowing red eyes, stunning, detailed, by artgerm, by greg rutkowski, by luis royo, by pixar, by myazaki, gothic, final fantasy, fantasy, medieval 
a photo of a robot standing in the middle of a street_____concept illustration. a giant robot standing in the high street of a run down seaside town 
a photo of a rabbit eating a carrot_____adorable anime bunny, eating a carrot, pastel colors 
a photo of a purple cube with a purple light on it_____symmetry!! a manufactured mystical aqua silver canal purple gilded colorful of medieval epic cube levitate design, floral!, elegant, highly detailed, magic surge, intricate, unreal engine 5, concept art ï¼Œ by greg rutkowski, loish, highly rendered, digital painting, artstation hq 
a photo of a monkey holding a stick_____a chimpanzee splitting an atom with a big stick. 
a photo of a man with a bunch of wires_____horror movie still, berlusconi as a cyberpunk zombie in a lab, full of medical wires, batteries, tech and drips 
a photo of a dark room with a large window_____a beautiful hyperdetailed render of hallway abandoned unfinished building building industrial architecture nature by frederic edwin church, apocalyptic azeroth evil vice city bioshock architecture island dieselpunk fantasy wilderness myst galactic synthwave, archdaily, wallpaper, highly detailed, trending on artstation. 
a photo of a spaceship flying over a field_____futuristic levitating luxury personal spaceship designed by apple with a laser cannons flying above the tundra forest art by greg rutkowski and paul ozzimo, epic fantasy sci - fi volumetric light clear focus detailed unreal engine digital art trending on artstation deviantart octane render, 
a photo of two people in leathers and a rainbow_____two time pilots wearing red rick owens pilot suits inside the glowing geometric rainbow portal to the sixth dimension by frank frazetta 
a photo of a baseball player with a red face_____a painting by edward hopper of a drawing of a man wearing a helmet with wings filled with colored crystals 
a photo of a circle with a green and yellow background_____by concept artists at pixar 
a photo of a man and woman in a cave_____bubonic plague 
a photo of a cat with a red rose on its head_____stunning god of feline skull portrait, skull, furry, crimson, fantasy, intricate, elegant, highly detailed, digital painting, artstation, concept art, smooth, sharp focus, illustration, art by afshar petros and krenz cushart and artem demura and tony sandoval 
a photo of a woman with a psychedelic face_____a intricate ornate psychedelic vibrant image of a flower goddess, art by artgerm, alex grey, psychedelic art, visionary art, fractalism, fractals, sacred geometry, trending on artstation, hyperrealistic, highly detailed, cgsociety, octane render, vray, 3 d. 
a photo of a mountain lake with a bridge in the middle_____render of dreamy beautiful landscape, dreamy, artger, large scale, details vintage photo hyper realistic ultra realistic photo realistic photography, unreal engine, high detailed, 8 k 
a photo of a city with trees and buildings_____a beautiful painting of rainy pripyat by nekro and pascal blanche and syd mead and greg rutkowski and beeple and victo ngai and simon stalenhag and chris voy. in style of cg art. ray tracing, cel shading, 3 d. ue 5. hyper detailed. realistic. maya. octane render. 
a photo of a woman in a field with flowers_____hyperrealistic portrait of a philippine character in a scenic environment, flowers, by beksinski zdzislaw, yoro sean, buchholz, quint, christensen james c., 
a photo of a black and white logo_____stylized sigils, cartoonish, demon realm, pentagon, vector illustration, minimalistic, aesthetic, gradient 
a photo of monsters playing a board game_____monsters playing board games, oil painting by justin gerard, deviantart, pixar, bright colors 
a photo of a woman holding a sword_____angel with a sword illustration by maxfield parrish, greg manchess, mucha 
